,Name,Score,Year,Url,Country1,Country2,Country3,Country4,Country5,Country6,Language1,Language2,Language3,Language4,Language5,Language6,Gross_revenue,Production1,Production2,Production3,Runtime,Rating,Genre1,Genre2,Genre3,Nums_score,Nums_review,Nums_critic,Story,Director1,Director2,Writer1,Writer2,Star1,Star2,Star3
111,Metropolis,8.2,1927,https://www.imdb.com//title/tt0017136/,Germany,,,,,,German,,,,,,1349711.0,Universum Film (UFA),,,153.0,Not Rated,Drama, Sci-Fi,,153322.0,484.0,203.0,"In a futuristic city sharply divided between the working class and the city planners, the son of the city's mastermind falls in love with a working class prophet who predicts the coming of a savior to mediate their differences.",Fritz Lang,,Thea von Harbou, Thea von Harbou,Brigitte Helm, Alfred Abel, Gustav Fröhlich
112,Ikiru,8.2,1952,https://www.imdb.com//title/tt0044741/,Japan,,,,,,Japanese,,,,,,90773.0,Toho Company,,,143.0,Not Rated,Drama,,,63390.0,204.0,122.0,A bureaucrat tries to find a meaning in his life after he discovers he has terminal cancer.,Akira Kurosawa,,Akira Kurosawa, Shinobu Hashimoto,Takashi Shimura, Nobuo Kaneko, Shin'ichi Himori
113,For a Few Dollars More,8.2,1965,https://www.imdb.com//title/tt0059578/,Italy, Spain, West Germany,,,,Italian, English,,,,,15000000.0,Produzioni Europee Associate (PEA), Arturo González Producciones Cinematográficas, Constantin Film,132.0,R,Western,,,221116.0,280.0,130.0,Two bounty hunters with the same intentions team up to track down a Western outlaw.,Sergio Leone,,Sergio Leone, Fulvio Morsella,Clint Eastwood, Lee Van Cleef, Gian Maria Volontè
114,A Separation,8.2,2011,https://www.imdb.com//title/tt1832382/,Iran, France,,,,,Persian,,,,,,22926076.0,Asghar Farhadi Productions, Dreamlab Films, MPA APSA Academy Film Fund,123.0,PG-13,Drama,,,210356.0,349.0,378.0,A married couple are faced with a difficult decision - to improve the life of their child by moving to another country or to stay in Iran and look after a deteriorating parent who has Alzheimer's disease.,Asghar Farhadi,,Asghar Farhadi,,Payman Maadi, Leila Hatami, Sareh Bayat
115,Double Indemnity,8.2,1944,https://www.imdb.com//title/tt0036775/,USA,,,,,,English,,,,,,13886.0,Paramount Pictures,,,107.0,Passed,Crime, Drama, Film-Noir,136660.0,384.0,146.0,An insurance representative lets himself be talked by a seductive housewife into a murder/insurance fraud scheme that arouses the suspicion of an insurance investigator.,Billy Wilder,,Billy Wilder, Raymond Chandler,Fred MacMurray, Barbara Stanwyck, Edward G. Robinson
116,The Apartment,8.2,1960,https://www.imdb.com//title/tt0053604/,USA,,,,,,English,,,,,,177066.0,The Mirisch Corporation,,,125.0,Not Rated,Comedy, Drama, Romance,155215.0,324.0,232.0,"A man tries to rise in his company by letting its executives use his apartment for trysts, but complications and a romance of his own ensue.",Billy Wilder,,Billy Wilder, I.A.L. Diamond,Jack Lemmon, Shirley MacLaine, Fred MacMurray
117,Incendies,8.2,2010,https://www.imdb.com//title/tt1255953/,Canada, France,,,,,French, Arabic, English,,,,7099598.0,micro_scope, TS Productions, Phi Group,131.0,R,Drama, Mystery, War,137443.0,237.0,240.0,Twins journey to the Middle East to discover their family history and fulfill their mother's last wishes.,Denis Villeneuve,,Denis Villeneuve, Wajdi Mouawad,Lubna Azabal, Mélissa Désormeaux-Poulin, Maxim Gaudette
118,To Kill a Mockingbird,8.2,1962,https://www.imdb.com//title/tt0056592/,USA,,,,,,English,,,,,,599146.0,Pakula-Mulligan, Brentwood Productions,,129.0,Approved,Crime, Drama,,285002.0,561.0,152.0,"Atticus Finch, a lawyer in the Depression-era South, defends a black man against an undeserved rape charge, and his children against prejudice.",Robert Mulligan,,Harper Lee, Horton Foote,Gregory Peck, John Megna, Frank Overton
119,Indiana Jones and the Last Crusade,8.2,1989,https://www.imdb.com//title/tt0097576/,USA,,,,,,English, German, Greek, Arabic,,,474310887.0,Paramount Pictures, Lucasfilm,,127.0,PG-13,Action, Adventure,,667137.0,554.0,166.0,"In 1938, after his father Professor Henry Jones, Sr. goes missing while pursuing the Holy Grail, Professor Henry ""Indiana"" Jones, Jr. finds himself up against Adolf Hitler's Nazis again to stop them from obtaining its powers.",Steven Spielberg,,Jeffrey Boam, George Lucas,Harrison Ford, Sean Connery, Alison Doody
120,Up,8.2,2009,https://www.imdb.com//title/tt1049413/,USA,,,,,,English,,,,,,735099082.0,Pixar Animation Studios, Walt Disney Pictures,,96.0,PG,Animation, Adventure, Comedy,897735.0,867.0,423.0,"78-year-old Carl Fredricksen travels to Paradise Falls in his house equipped with balloons, inadvertently taking a young stowaway.",Pete Docter, Bob Peterson,Pete Docter, Bob Peterson,Edward Asner, Jordan Nagai, John Ratzenberger
121,L.A. Confidential,8.2,1997,https://www.imdb.com//title/tt0119488/,USA,,,,,,English,,,,,,126216940.0,Regency Enterprises, The Wolper Organization, Warner Bros.,138.0,R,Crime, Drama, Mystery,514721.0,699.0,132.0,"As corruption grows in 1950s Los Angeles, three policemen - one strait-laced, one brutal, and one sleazy - investigate a series of murders with their own brand of justice.",Curtis Hanson,,James Ellroy, Brian Helgeland,Kevin Spacey, Russell Crowe, Guy Pearce
122,Heat,8.2,1995,https://www.imdb.com//title/tt0113277/,USA,,,,,,English, Spanish,,,,,187436818.0,Warner Bros., Regency Enterprises, Forward Pass,170.0,R,Crime, Drama, Thriller,552784.0,1055.0,208.0,A group of professional bank robbers start to feel the heat from police when they unknowingly leave a clue at their latest heist.,Michael Mann,,Michael Mann,,Al Pacino, Robert De Niro, Val Kilmer
123,Monty Python and the Holy Grail,8.2,1975,https://www.imdb.com//title/tt0071853/,UK,,,,,,English, French, Latin,,,,1938877.0,Python (Monty) Pictures, Michael White Productions, National Film Trustee Company,91.0,PG,Adventure, Comedy, Fantasy,484904.0,763.0,107.0,"King Arthur (Graham Chapman) and his Knights of the Round Table embark on a surreal, low-budget search for the Holy Grail, encountering many, very silly obstacles.",Terry Gilliam, Terry Jones,Graham Chapman, John Cleese,Graham Chapman, John Cleese, Eric Idle
124,Die Hard,8.2,1988,https://www.imdb.com//title/tt0095016/,USA,,,,,,English, German, Italian, Japanese,,,141482154.0,Twentieth Century Fox, Gordon Company, Silver Pictures,132.0,R,Action, Thriller,,758195.0,901.0,291.0,An NYPD officer tries to save his wife and several others taken hostage by German terrorists during a Christmas party at the Nakatomi Plaza in Los Angeles.,John McTiernan,,Roderick Thorp, Jeb Stuart,Bruce Willis, Alan Rickman, Bonnie Bedelia
125,Rashômon,8.2,1950,https://www.imdb.com//title/tt0042876/,Japan,,,,,,Japanese,,,,,,46808.0,Daiei,,,88.0,Not Rated,Crime, Drama, Mystery,144748.0,335.0,138.0,"The rape of a bride and the murder of her samurai husband are recalled from the perspectives of a bandit, the bride, the samurai's ghost and a woodcutter.",Akira Kurosawa,,Ryûnosuke Akutagawa, Akira Kurosawa,Toshirô Mifune, Machiko Kyô, Masayuki Mori
126,Yojimbo,8.2,1961,https://www.imdb.com//title/tt0055630/,Japan,,,,,,Japanese,,,,,,46808.0,Kurosawa Production Co., Toho Company,,110.0,Not Rated,Action, Drama, Thriller,104851.0,194.0,120.0,A crafty ronin comes to a town divided by two criminal gangs and decides to play them against each other to free the town.,Akira Kurosawa,,Akira Kurosawa, Akira Kurosawa,Toshirô Mifune, Eijirô Tôno, Tatsuya Nakadai
127,Batman Begins,8.2,2005,https://www.imdb.com//title/tt0372784/,USA, UK,,,,,English, Mandarin,,,,,373413297.0,Warner Bros., Syncopy, DC Comics,140.0,PG-13,Action, Adventure,,1259635.0,2854.0,319.0,"After training with his mentor, Batman begins his fight to free crime-ridden Gotham City from corruption.",Christopher Nolan,,Bob Kane, David S. Goyer,Christian Bale, Michael Caine, Ken Watanabe
128,Come and See,8.2,1985,https://www.imdb.com//title/tt0091251/,Soviet Union,,,,,,Belarusian, Russian, German,,,,168817.0,Belarusfilm, Mosfilm,,142.0,Not Rated,Drama, War,,50400.0,488.0,97.0,"After finding an old rifle, a young boy joins the Soviet resistance movement against ruthless German forces and experiences the horrors of World War II.",Elem Klimov,,Ales Adamovich, Ales Adamovich,Aleksey Kravchenko, Olga Mironova, Liubomiras Laucevicius
129,Children of Heaven,8.2,1997,https://www.imdb.com//title/tt0118849/,Iran,,,,,,Persian,,,,,,933933.0,Kanun parvaresh fekri,,,89.0,PG,Drama, Family, Sport,60172.0,176.0,57.0,"After a boy loses his sister's pair of shoes, he goes on a series of adventures in order to find them. When he can't, he tries a new way to ""win"" a new pair.",Majid Majidi,,Majid Majidi,,Mohammad Amir Naji, Amir Farrokh Hashemian, Bahare Seddiqi
130,Green Book,8.2,2018,https://www.imdb.com//title/tt6966692/,USA, China,,,,,English, Italian, Russian, German,,,327909440.0,Participant, DreamWorks, Innisfree Pictures,130.0,PG-13,Biography, Comedy, Drama,320108.0,1404.0,394.0,A working-class Italian-American bouncer becomes the driver of an African-American classical pianist on a tour of venues through the 1960s American South.,Peter Farrelly,,Nick Vallelonga, Brian Hayes Currie,Viggo Mortensen, Mahershala Ali, Linda Cardellini
131,Downfall,8.2,2004,https://www.imdb.com//title/tt0363163/,Germany, Austria, Italy,,,,German, Russian,,,,,92181574.0,Constantin Film, Norddeutscher Rundfunk (NDR), Westdeutscher Rundfunk (WDR),156.0,R,Biography, Drama, History,320216.0,627.0,208.0,"Traudl Junge, the final secretary for Adolf Hitler, tells of the Nazi dictator's final days in his Berlin bunker at the end of WWII.",Oliver Hirschbiegel,,Bernd Eichinger, Joachim Fest,Bruno Ganz, Alexandra Maria Lara, Ulrich Matthes
132,Unforgiven,8.2,1992,https://www.imdb.com//title/tt0105695/,USA,,,,,,English,,,,,,159157447.0,Warner Bros., Malpaso Productions,,130.0,R,Drama, Western,,360562.0,577.0,121.0,"Retired Old West gunslinger William Munny (Clint Eastwood) reluctantly takes on one last job, with the help of his old partner Ned Logan (Morgan Freeman) and a young man, The ""Schofield Kid"" (Jaimz Woolvett).",Clint Eastwood,,David Webb Peoples,,Clint Eastwood, Gene Hackman, Morgan Freeman
133,Some Like It Hot,8.2,1959,https://www.imdb.com//title/tt0053291/,USA,,,,,,English,,,,,,83169282.0,Ashton Productions, The Mirisch Corporation,,121.0,Not Rated,Comedy, Music, Romance,233914.0,408.0,220.0,"After two male musicians witness a mob hit, they flee the state in an all-female band disguised as women, but further complications set in.",Billy Wilder,,Billy Wilder, I.A.L. Diamond,Marilyn Monroe, Tony Curtis, Jack Lemmon
134,Ran,8.2,1985,https://www.imdb.com//title/tt0089881/,Japan, France,,,,,Japanese,,,,,,4160924.0,Greenwich Film Productions, Herald Ace, Nippon Herald Films,162.0,R,Action, Drama, War,106028.0,275.0,155.0,"In Medieval Japan, an elderly warlord retires, handing over his empire to his three sons. However, he vastly underestimates how the new-found power will corrupt them and cause them to turn on each other...and him.",Akira Kurosawa,,Akira Kurosawa, Hideo Oguni,Tatsuya Nakadai, Akira Terao, Jinpachi Nezu
135,Howl's Moving Castle,8.2,2004,https://www.imdb.com//title/tt0347149/,Japan,,,,,,Japanese,,,,,,236212992.0,Buena Vista Home Entertainment, DENTSU Music And Entertainment, Mitsubishi,119.0,PG,Animation, Adventure, Family,308007.0,422.0,241.0,"When an unconfident young woman is cursed with an old body by a spiteful witch, her only chance of breaking the spell lies with a self-indulgent yet insecure young wizard and his companions in his legged, walking castle.",Hayao Miyazaki,,Hayao Miyazaki, Diana Wynne Jones,Chieko Baishô, Takuya Kimura, Tatsuya Gashûin
136,The Great Escape,8.2,1963,https://www.imdb.com//title/tt0057115/,USA,,,,,,English, German, French, Russian, Spanish,,227940.0,The Mirisch Company, Alpha,,172.0,Not Rated,Adventure, Drama, History,215895.0,349.0,105.0,Allied prisoners of war plan for several hundred of their number to escape from a German camp during World War II.,John Sturges,,Paul Brickhill, James Clavell,Steve McQueen, James Garner, Richard Attenborough
137,All About Eve,8.2,1950,https://www.imdb.com//title/tt0042192/,USA,,,,,,English, French,,,,,150438.0,Twentieth Century Fox,,,138.0,Passed,Drama,,,115503.0,370.0,137.0,A seemingly timid but secretly ruthless ingénue insinuates herself into the lives of an aging Broadway star and her circle of theater friends.,Joseph L. Mankiewicz,,Joseph L. Mankiewicz,,Bette Davis, Anne Baxter, George Sanders
138,A Beautiful Mind,8.2,2001,https://www.imdb.com//title/tt0268978/,USA,,,,,,English,,,,,,316791257.0,Universal Pictures, DreamWorks, Imagine Entertainment,135.0,PG-13,Biography, Drama,,815318.0,1275.0,158.0,"After John Nash, a brilliant but asocial mathematician, accepts secret work in cryptography, his life takes a turn for the nightmarish.",Ron Howard,,Akiva Goldsman, Sylvia Nasar,Russell Crowe, Ed Harris, Jennifer Connelly
139,Casino,8.2,1995,https://www.imdb.com//title/tt0112641/,France, USA,,,,,English,,,,,,116112375.0,Universal Pictures, Syalis DA, Légende Entreprises,178.0,R,Crime, Drama,,442788.0,613.0,158.0,"A tale of greed, deception, money, power, and murder occur between two best friends: a mafia enforcer and a casino executive, compete against each other over a gambling empire, and over a fast living and fast loving socialite.",Martin Scorsese,,Nicholas Pileggi, Nicholas Pileggi,Robert De Niro, Sharon Stone, Joe Pesci
140,Pan's Labyrinth,8.2,2006,https://www.imdb.com//title/tt0457430/,Mexico, Spain,,,,,Spanish,,,,,,83850267.0,Estudios Picasso, Wild Bunch, Tequila Gang,118.0,R,Drama, Fantasy, War,598935.0,1260.0,454.0,"In the Falangist Spain of 1944, the bookish young stepdaughter of a sadistic army officer escapes into an eerie but captivating fantasy world.",Guillermo del Toro,,Guillermo del Toro,,Ivana Baquero, Ariadna Gil, Sergi López
141,The Secret in Their Eyes,8.2,2009,https://www.imdb.com//title/tt1305806/,Argentina, Spain,,,,,Spanish,,,,,,42629597.0,Tornasol Films, Haddock Films, 100 Bares,129.0,R,Drama, Mystery, Romance,184010.0,288.0,279.0,A retired legal counselor writes a novel hoping to find closure for one of his past unresolved homicide cases and for his unreciprocated love with his superior - both of which still haunt him decades later.,Juan José Campanella,,Eduardo Sacheri, Juan José Campanella,Ricardo Darín, Soledad Villamil, Pablo Rago
142,My Neighbor Totoro,8.2,1988,https://www.imdb.com//title/tt0096283/,Japan,,,,,,Japanese,,,,,,30476708.0,Tokuma Japan Communications, Studio Ghibli, Nibariki,86.0,G,Animation, Family, Fantasy,268406.0,438.0,180.0,"When two girls move to the country to be near their ailing mother, they have adventures with the wondrous forest spirits who live nearby.",Hayao Miyazaki,,Hayao Miyazaki,,Hitoshi Takagi, Noriko Hidaka, Chika Sakamoto
143,The Wolf of Wall Street,8.2,2013,https://www.imdb.com//title/tt0993846/,USA,,,,,,English, French,,,,,392000694.0,Red Granite Pictures, Appian Way, Sikelia Productions,180.0,R,Biography, Crime, Drama,1114452.0,1385.0,641.0,"Based on the true story of Jordan Belfort, from his rise to a wealthy stock-broker living the high life to his fall involving crime, corruption and the federal government.",Martin Scorsese,,Terence Winter, Jordan Belfort,Leonardo DiCaprio, Jonah Hill, Margot Robbie
144,"Lock, Stock and Two Smoking Barrels",8.2,1998,https://www.imdb.com//title/tt0120735/,UK,,,,,,English,,,,,,3753929.0,Summit Entertainment, The Steve Tisch Company, SKA Films,107.0,R,Comedy, Crime,,517207.0,578.0,119.0,"A botched card game in London triggers four friends, thugs, weed-growers, hard gangsters, loan sharks and debt collectors to collide with each other in a series of unexpected events, all for the sake of weed, cash and two antique shotguns.",Guy Ritchie,,Guy Ritchie,,Jason Flemyng, Dexter Fletcher, Nick Moran
145,Raging Bull,8.2,1980,https://www.imdb.com//title/tt0081398/,USA,,,,,,English,,,,,,23402117.0,Chartoff-Winkler Productions,,,129.0,R,Biography, Drama, Sport,308237.0,573.0,189.0,"The life of boxer Jake LaMotta, whose violence and temper that led him to the top in the ring destroyed his life outside of it.",Martin Scorsese,,Jake LaMotta, Joseph Carter,Robert De Niro, Cathy Moriarty, Joe Pesci
146,The Treasure of the Sierra Madre,8.1,1948,https://www.imdb.com//title/tt0040897/,USA, Mexico,,,,,English, Spanish,,,,,215295.0,Warner Bros.,,,126.0,Passed,Adventure, Drama, Western,109324.0,265.0,95.0,Two Americans searching for work in Mexico convince an old prospector to help them mine for gold in the Sierra Madre Mountains.,John Huston,,John Huston, B. Traven,Humphrey Bogart, Walter Huston, Tim Holt
147,Judgment at Nuremberg,8.1,1961,https://www.imdb.com//title/tt0055031/,USA,,,,,,English, German,,,,,12180.0,Roxlom Films Inc.,,,179.0,Not Rated,Drama, War,,65936.0,207.0,99.0,"In 1948, an American court in occupied Germany tries four Nazis judged for war crimes.",Stanley Kramer,,Abby Mann, Abby Mann,Spencer Tracy, Burt Lancaster, Richard Widmark
148,There Will Be Blood,8.1,2007,https://www.imdb.com//title/tt0469494/,USA,,,,,,English, American Sign Language,,,,,76181545.0,Paramount Vantage, Miramax, Ghoulardi Film Company,158.0,R,Drama,,,493148.0,1289.0,341.0,"A story of family, religion, hatred, oil and madness, focusing on a turn-of-the-century prospector in the early days of the business.",Paul Thomas Anderson,,Paul Thomas Anderson, Upton Sinclair,Daniel Day-Lewis, Paul Dano, Ciarán Hinds
149,Babam ve Oglum,8.1,2005,https://www.imdb.com//title/tt0476735/,Turkey,,,,,,Turkish,,,,,,18612999.0,Avsar Film,,,112.0,G,Drama, Family,,74402.0,121.0,6.0,The family of a left-wing journalist is torn apart after the military coup of Turkey in 1980.,Çagan Irmak,,Çagan Irmak,,Çetin Tekindor, Fikret Kuskan, Hümeyra
150,"Three Billboards Outside Ebbing, Missouri",8.1,2017,https://www.imdb.com//title/tt5027774/,UK, USA,,,,,English,,,,,,160192031.0,Blueprint Pictures, Film 4, Fox Searchlight Pictures,115.0,R,Comedy, Crime, Drama,397438.0,1147.0,573.0,A mother personally challenges the local authorities to solve her daughter's murder when they fail to catch the culprit.,Martin McDonagh,,Martin McDonagh,,Frances McDormand, Woody Harrelson, Sam Rockwell
151,The Gold Rush,8.1,1925,https://www.imdb.com//title/tt0015864/,USA,,,,,,English, None,,,,,26916.0,Charles Chaplin Productions,,,95.0,Not Rated,Adventure, Comedy, Drama,95180.0,181.0,123.0,A prospector goes to the Klondike in search of gold and finds it and more.,Charles Chaplin,,Charles Chaplin,,Charles Chaplin, Mack Swain, Tom Murray
152,Chinatown,8.1,1974,https://www.imdb.com//title/tt0071315/,USA,,,,,,English, Cantonese, Spanish,,,,29225935.0,Paramount Pictures, Penthouse Video, Long Road Productions,130.0,R,Drama, Mystery, Thriller,281425.0,526.0,262.0,"A private detective hired to expose an adulterer finds himself caught up in a web of deceit, corruption, and murder.",Roman Polanski,,Robert Towne,,Jack Nicholson, Faye Dunaway, John Huston
153,Dial M for Murder,8.1,1954,https://www.imdb.com//title/tt0046912/,USA,,,,,,English,,,,,,18816.0,Warner Bros.,,,105.0,PG,Crime, Thriller,,149834.0,341.0,102.0,A tennis player tries to arrange his wife's murder after learning of her affair.,Alfred Hitchcock,,Frederick Knott, Frederick Knott,Ray Milland, Grace Kelly, Robert Cummings
154,V for Vendetta,8.1,2005,https://www.imdb.com//title/tt0434409/,USA, UK, Germany,,,,English,,,,,,132511035.0,Warner Bros., Virtual Studios, Silver Pictures,132.0,R,Action, Drama, Sci-Fi,994945.0,2190.0,189.0,"In a future British tyranny, a shadowy freedom fighter, known only by the alias of ""V"", plots to overthrow it with the help of a young woman.",James McTeigue,,Lilly Wachowski, Lana Wachowski,Hugo Weaving, Natalie Portman, Rupert Graves
155,The Seventh Seal,8.1,1957,https://www.imdb.com//title/tt0050976/,Sweden,,,,,,Swedish, Latin,,,,,230571.0,Svensk Filmindustri (SF),,,96.0,Not Rated,Drama, Fantasy,,155229.0,331.0,116.0,"A man seeks answers about life, death, and the existence of God as he plays chess against the Grim Reaper during the Black Plague.",Ingmar Bergman,,Ingmar Bergman, Ingmar Bergman,Max von Sydow, Gunnar Björnstrand, Bengt Ekerot
156,No Country for Old Men,8.1,2007,https://www.imdb.com//title/tt0477348/,USA, Mexico,,,,,English, Spanish,,,,,171627166.0,Paramount Vantage, Miramax, Scott Rudin Productions,122.0,R,Crime, Drama, Thriller,814504.0,1784.0,536.0,Violence and mayhem ensue after a hunter stumbles upon a drug deal gone wrong and more than two million dollars in cash near the Rio Grande.,Ethan Coen, Joel Coen,Joel Coen, Ethan Coen,Tommy Lee Jones, Javier Bardem, Josh Brolin
157,Inside Out,8.1,2015,https://www.imdb.com//title/tt2096673/,USA,,,,,,English,,,,,,857611174.0,Pixar Animation Studios, Walt Disney Pictures,,95.0,PG,Animation, Adventure, Comedy,580609.0,1012.0,585.0,"After young Riley is uprooted from her Midwest life and moved to San Francisco, her emotions - Joy, Fear, Anger, Disgust and Sadness - conflict on how best to navigate a new city, house, and school.",Pete Docter, Ronnie Del Carmen,Pete Docter, Ronnie Del Carmen,Amy Poehler, Bill Hader, Lewis Black
158,Warrior,8.1,2011,https://www.imdb.com//title/tt1291584/,USA,,,,,,English, Spanish,,,,,23308615.0,Lionsgate, Mimran Schur Pictures, Solaris,140.0,PG-13,Drama, Sport,,421730.0,665.0,336.0,"The youngest son of an alcoholic former boxer returns home, where he's trained by his father for competition in a mixed martial arts tournament - a path that puts the fighter on a collision course with his estranged, older brother.",Gavin O'Connor,,Gavin O'Connor, Anthony Tambakis,Tom Hardy, Nick Nolte, Joel Edgerton
159,Shutter Island,8.1,2010,https://www.imdb.com//title/tt1130884/,USA,,,,,,English, German,,,,,294804195.0,Paramount Pictures, Phoenix Pictures, Sikelia Productions,138.0,R,Mystery, Thriller,,1075420.0,1226.0,530.0,"In 1954, a U.S. Marshal investigates the disappearance of a murderer who escaped from a hospital for the criminally insane.",Martin Scorsese,,Laeta Kalogridis, Dennis Lehane,Leonardo DiCaprio, Emily Mortimer, Mark Ruffalo
160,Trainspotting,8.1,1996,https://www.imdb.com//title/tt0117951/,UK,,,,,,English,,,,,,16593356.0,Channel Four Films, Figment Films, The Noel Gay Motion Picture Company,93.0,R,Drama,,,616078.0,617.0,148.0,"Renton, deeply immersed in the Edinburgh drug scene, tries to clean up and get out, despite the allure of the drugs and influence of friends.",Danny Boyle,,Irvine Welsh, John Hodge,Ewan McGregor, Ewen Bremner, Jonny Lee Miller
161,The Elephant Man,8.1,1980,https://www.imdb.com//title/tt0080678/,USA, UK,,,,,English,,,,,,26020641.0,Brooksfilms,,,124.0,PG,Biography, Drama,,210711.0,408.0,143.0,"A Victorian surgeon rescues a heavily disfigured man who is mistreated while scraping a living as a side-show freak. Behind his monstrous façade, there is revealed a person of kindness, intelligence and sophistication.",David Lynch,,Christopher De Vore, Eric Bergren,Anthony Hopkins, John Hurt, Anne Bancroft
162,The Sixth Sense,8.1,1999,https://www.imdb.com//title/tt0167404/,USA,,,,,,English, Latin, Spanish,,,,672806292.0,Hollywood Pictures, Spyglass Entertainment, The Kennedy/Marshall Company,107.0,PG-13,Drama, Mystery, Thriller,882823.0,2207.0,265.0,A boy who communicates with spirits seeks the help of a disheartened child psychologist.,M. Night Shyamalan,,M. Night Shyamalan,,Bruce Willis, Haley Joel Osment, Toni Collette
163,The Thing,8.1,1982,https://www.imdb.com//title/tt0084787/,USA,,,,,,English, Norwegian,,,,,19629760.0,Universal Pictures, Turman-Foster Company,,109.0,R,Horror, Mystery, Sci-Fi,353251.0,1078.0,346.0,A research team in Antarctica is hunted by a shape-shifting alien that assumes the appearance of its victims.,John Carpenter,,Bill Lancaster, John W. Campbell Jr.,Kurt Russell, Wilford Brimley, Keith David
164,Gone with the Wind,8.1,1939,https://www.imdb.com//title/tt0031381/,USA,,,,,,English,,,,,,402352579.0,Selznick International Pictures, Metro-Goldwyn-Mayer (MGM),,238.0,Passed,Drama, History, Romance,277807.0,844.0,187.0,A manipulative woman and a roguish man conduct a turbulent romance during the American Civil War and Reconstruction periods.,Victor Fleming, George Cukor,Margaret Mitchell, Sidney Howard,Clark Gable, Vivien Leigh, Thomas Mitchell
165,Room,8.1,2015,https://www.imdb.com//title/tt3170832/,Ireland, Canada, UK, USA,,,English,,,,,,35401758.0,Element Pictures, Film 4, FilmNation Entertainment,118.0,R,Drama, Thriller,,347427.0,642.0,476.0,"Held captive for 7 years in an enclosed space, a woman and her young son finally gain their freedom, allowing the boy to experience the outside world for the first time.",Lenny Abrahamson,,Emma Donoghue, Emma Donoghue,Brie Larson, Jacob Tremblay, Sean Bridgers
166,Jurassic Park,8.1,1993,https://www.imdb.com//title/tt0107290/,USA,,,,,,English, Spanish,,,,,1032020521.0,Universal Pictures, Amblin Entertainment,,127.0,PG-13,Action, Adventure, Sci-Fi,828734.0,1098.0,356.0,A pragmatic paleontologist visiting an almost complete theme park is tasked with protecting a couple of kids after a power failure causes the park's cloned dinosaurs to run loose.,Steven Spielberg,,Michael Crichton, Michael Crichton,Sam Neill, Laura Dern, Jeff Goldblum
167,Wild Strawberries,8.1,1957,https://www.imdb.com//title/tt0050986/,Sweden,,,,,,Swedish, Latin,,,,,14524.0,Svensk Filmindustri (SF),,,91.0,Not Rated,Drama, Romance,,90509.0,175.0,96.0,"After living a life marked by coldness, an aging professor is forced to confront the emptiness of his existence.",Ingmar Bergman,,Ingmar Bergman,,Victor Sjöström, Bibi Andersson, Ingrid Thulin
