,Name,Score,Year,Url,Country1,Country2,Country3,Country4,Country5,Country6,Language1,Language2,Language3,Language4,Language5,Language6,Gross_revenue,Production1,Production2,Production3,Runtime,Rating,Genre1,Genre2,Genre3,Nums_score,Nums_review,Nums_critic,Story,Director1,Director2,Writer1,Writer2,Star1,Star2,Star3
168,Blade Runner,8.1,1982,https://www.imdb.com//title/tt0083658/,USA,,,,,,English, German, Cantonese, Japanese, Hungarian, Arabic,41473619.0,The Ladd Company, Shaw Brothers, Warner Bros.,117.0,R,Action, Sci-Fi, Thriller,667101.0,1524.0,256.0,"A blade runner must pursue and terminate four replicants who stole a ship in space, and have returned to Earth to find their creator.",Ridley Scott,,Hampton Fancher, David Webb Peoples,Harrison Ford, Rutger Hauer, Sean Young
169,The Bridge on the River Kwai,8.1,1957,https://www.imdb.com//title/tt0050212/,UK, USA,,,,,English, Japanese, Thai,,,,27200000.0,Horizon Pictures (II),,,161.0,PG,Adventure, Drama, War,195562.0,321.0,93.0,"British POWs are forced to build a railway bridge across the river Kwai for their Japanese captors, not knowing that the allied forces are planning to destroy it.",David Lean,,Pierre Boulle, Carl Foreman,William Holden, Alec Guinness, Jack Hawkins
170,Finding Nemo,8.1,2003,https://www.imdb.com//title/tt0266543/,USA, Australia,,,,,English,,,,,,940343261.0,Pixar Animation Studios, Walt Disney Pictures,,100.0,G,Animation, Adventure, Comedy,915611.0,953.0,148.0,"After his son is captured in the Great Barrier Reef and taken to Sydney, a timid clownfish sets out on a journey to bring him home.",Andrew Stanton, Lee Unkrich,Andrew Stanton, Andrew Stanton,Albert Brooks, Ellen DeGeneres, Alexander Gould
171,Stalker,8.1,1979,https://www.imdb.com//title/tt0079944/,Soviet Union,,,,,,Russian,,,,,,303806.0,Mosfilm, Vtoroe Tvorcheskoe Obedinenie,,162.0,Not Rated,Drama, Sci-Fi,,108305.0,405.0,157.0,A guide leads two men through an area known as the Zone to find a room that grants wishes.,Andrei Tarkovsky,,Arkadiy Strugatskiy, Boris Strugatskiy,Alisa Freyndlikh, Aleksandr Kaydanovskiy, Anatoliy Solonitsyn
172,On the Waterfront,8.1,1954,https://www.imdb.com//title/tt0047296/,USA,,,,,,English,,,,,,0.0,Horizon Pictures,,,108.0,Not Rated,Crime, Drama, Thriller,135877.0,320.0,158.0,An ex-prize fighter turned longshoreman struggles to stand up to his corrupt union bosses.,Elia Kazan,,Budd Schulberg, Budd Schulberg,Marlon Brando, Karl Malden, Lee J. Cobb
173,The Third Man,8.1,1949,https://www.imdb.com//title/tt0041959/,UK,,,,,,English, German, Russian,,,,1225424.0,London Film Productions,,,104.0,Not Rated,Film-Noir, Mystery, Thriller,152721.0,467.0,249.0,"Pulp novelist Holly Martins travels to shadowy, postwar Vienna, only to find himself investigating the mysterious death of an old friend, Harry Lime.",Carol Reed,,Graham Greene, Graham Greene,Orson Welles, Joseph Cotten, Alida Valli
174,The Truman Show,8.1,1998,https://www.imdb.com//title/tt0120382/,USA,,,,,,English,,,,,,264118201.0,Paramount Pictures, Scott Rudin Productions,,103.0,PG,Comedy, Drama, Sci-Fi,891554.0,1120.0,254.0,An insurance salesman discovers his whole life is actually a reality TV show.,Peter Weir,,Andrew Niccol,,Jim Carrey, Ed Harris, Laura Linney
175,Fargo,8.1,1996,https://www.imdb.com//title/tt0116282/,USA, UK,,,,,English,,,,,,60611975.0,PolyGram Filmed Entertainment, Working Title Films,,98.0,R,Crime, Drama, Thriller,591719.0,938.0,226.0,Jerry Lundegaard's inept crime falls apart due to his and his henchmen's bungling and the persistent police work of the quite pregnant Marge Gunderson.,Joel Coen, Ethan Coen,Ethan Coen, Joel Coen,William H. Macy, Frances McDormand, Steve Buscemi
176,Kill Bill: Vol. 1,8.1,2003,https://www.imdb.com//title/tt0266697/,USA, Japan,,,,,English, Japanese, French,,,,180899045.0,Miramax, A Band Apart, Super Cool ManChu,111.0,R,Action, Crime, Thriller,962437.0,2251.0,367.0,"After awakening from a four-year coma, a former assassin wreaks vengeance on the team of assassins who betrayed her.",Quentin Tarantino,,Quentin Tarantino, Quentin Tarantino,Uma Thurman, David Carradine, Daryl Hannah
177,Gran Torino,8.1,2008,https://www.imdb.com//title/tt1205489/,Germany, USA,,,,,English, Hmong,,,,,269958228.0,Matten Productions, Double Nickel Entertainment, Gerber Pictures,116.0,R,Drama,,,698605.0,976.0,370.0,"Disgruntled Korean War veteran Walt Kowalski sets out to reform his neighbor, Thao Lor, a Hmong teenager who tried to steal Kowalski's prized possession: a 1972 Gran Torino.",Clint Eastwood,,Nick Schenk, Dave Johannson,Clint Eastwood, Bee Vang, Christopher Carley
178,Tokyo Story,8.1,1953,https://www.imdb.com//title/tt0046438/,Japan,,,,,,Japanese, English,,,,,40405.0,Shochiku,,,136.0,Not Rated,Drama,,,48522.0,153.0,105.0,"An old couple visit their children and grandchildren in the city, but receive little attention.",Yasujirô Ozu,,Kôgo Noda, Yasujirô Ozu,Chishû Ryû, Chieko Higashiyama, Sô Yamamura
179,The Deer Hunter,8.1,1978,https://www.imdb.com//title/tt0077416/,USA,,,,,,English, Russian, Vietnamese, French,,,49074243.0,EMI Films, Universal Pictures,,183.0,R,Drama, War,,299563.0,1124.0,159.0,An in-depth examination of the ways in which the U.S. Vietnam War impacts and disrupts the lives of people in a small industrial town in Pennsylvania.,Michael Cimino,,Michael Cimino, Deric Washburn,Robert De Niro, Christopher Walken, John Cazale
180,Memories of Murder,8.1,2003,https://www.imdb.com//title/tt0353969/,South Korea,,,,,,Korean, English,,,,,927398.0,CJ Entertainment, Muhan Investment, Sidus,131.0,Not Rated,Action, Crime, Drama,121783.0,223.0,172.0,"In a small Korean province in 1986, two detectives struggle with the case of multiple young women being found raped and murdered by an unknown culprit.",Bong Joon Ho,,Bong Joon Ho, Kwang-rim Kim,Kang-ho Song, Sang-kyung Kim, Roe-ha Kim
181,Relatos salvajes,8.1,2014,https://www.imdb.com//title/tt3011894/,Argentina, Spain, France, UK,,,Spanish,,,,,,30642704.0,British Film Institute (BFI), Canal+, Corner Producciones,122.0,R,Comedy, Drama, Thriller,165524.0,222.0,309.0,Six short stories that explore the extremities of human behavior involving people in distress.,Damián Szifron,,Germán Servidio, Damián Szifron,Darío Grandinetti, María Marull, Mónica Villa
182,Klaus,8.1,2019,https://www.imdb.com//title/tt4729430/,Spain,,,,,,English, Saami,,,,,0.0,The SPA Studios, Atresmedia Cine,,96.0,PG,Animation, Adventure, Comedy,68012.0,563.0,98.0,"A simple act of kindness always sparks another, even in a frozen, faraway place. When Smeerensburg's new postman, Jesper, befriends toymaker Klaus, their gifts melt an age-old feud and deliver a sleigh full of holiday traditions.",Sergio Pablos, Carlos Martínez López,Sergio Pablos, Sergio Pablos,Jason Schwartzman, J.K. Simmons, Rashida Jones
183,The Bandit,8.1,1996,https://www.imdb.com//title/tt0116231/,Turkey, France, Bulgaria,,,,Turkish,,,,,,0.0,Artcam International, Filma-Cass, Geopoly,128.0,TV-MA,Crime, Drama, Thriller,60353.0,53.0,5.0,"Baran the Bandit, released from prison after 35 years, searches for vengeance and his lover.",Yavuz Turgul,,Yavuz Turgul,,Sener Sen, Ugur Yücel, Sermin Hürmeriç
184,Andhadhun,8.1,2018,https://www.imdb.com//title/tt8108198/,India,,,,,,Hindi, English,,,,,49391206.0,Matchbox Pictures, Viacom18 Motion Pictures,,139.0,Not Rated,Crime, Thriller,,60510.0,824.0,31.0,"A series of mysterious events change the life of a blind pianist, who must now report a crime that he should technically know nothing of.",Sriram Raghavan,,Arijit Biswas, Yogesh Chandekar,Ayushmann Khurrana, Tabu, Radhika Apte
185,Mary and Max,8.1,2009,https://www.imdb.com//title/tt0978762/,Australia,,,,,,English, Yiddish,,,,,1739445.0,Melodrama Pictures,,,92.0,Not Rated,Animation, Comedy, Drama,158599.0,222.0,181.0,"A tale of friendship between two unlikely pen pals: Mary, a lonely, eight-year-old girl living in the suburbs of Melbourne, and Max, a forty-four-year old, severely obese man living in New York.",Adam Elliot,,Adam Elliot,,Toni Collette, Philip Seymour Hoffman, Eric Bana
186,The Big Lebowski,8.1,1998,https://www.imdb.com//title/tt0118715/,USA, UK,,,,,English, German, Hebrew, Spanish,,,46735469.0,Polygram Filmed Entertainment, Working Title Films,,117.0,R,Comedy, Crime, Sport,699903.0,1205.0,189.0,"Jeff ""The Dude"" Lebowski, mistaken for a millionaire of the same name, seeks restitution for his ruined rug and enlists his bowling buddies to help get it.",Joel Coen, Ethan Coen,Ethan Coen, Joel Coen,Jeff Bridges, John Goodman, Julianne Moore
187,In the Name of the Father,8.1,1993,https://www.imdb.com//title/tt0107207/,Ireland, UK,,,,,English,,,,,,65796862.0,Hell's Kitchen Films, Universal Pictures,,133.0,R,Biography, Drama,,149652.0,178.0,59.0,A man's coerced confession to an I.R.A. bombing he did not commit results in the imprisonment of his father as well. An English lawyer fights to free them.,Jim Sheridan,,Gerry Conlon, Terry George,Daniel Day-Lewis, Pete Postlethwaite, Alison Crosbie
188,Gone Girl,8.1,2014,https://www.imdb.com//title/tt2267998/,USA,,,,,,English,,,,,,369330363.0,Twentieth Century Fox, Regency Enterprises, TSG Entertainment,149.0,R,Drama, Mystery, Thriller,816559.0,1421.0,618.0,"With his wife's disappearance having become the focus of an intense media circus, a man sees the spotlight turned on him when it's suspected that he may not be innocent.",David Fincher,,Gillian Flynn, Gillian Flynn,Ben Affleck, Rosamund Pike, Neil Patrick Harris
189,Hacksaw Ridge,8.1,2016,https://www.imdb.com//title/tt2119532/,Australia, USA,,,,,English, Japanese,,,,,180450918.0,Summit Entertainment, Cross Creek Pictures, Demarest Films,139.0,R,Biography, Drama, History,406764.0,869.0,468.0,"World War II American Army Medic Desmond T. Doss, who served during the Battle of Okinawa, refuses to kill people, and becomes the first man in American history to receive the Medal of Honor without firing a shot.",Mel Gibson,,Robert Schenkkan, Andrew Knight,Andrew Garfield, Sam Worthington, Luke Bracey
190,The Grand Budapest Hotel,8.1,2014,https://www.imdb.com//title/tt2278388/,Germany, USA,,,,,English, French, German,,,,172936941.0,Fox Searchlight Pictures, Indian Paintbrush, Studio Babelsberg,99.0,R,Adventure, Comedy, Crime,675046.0,845.0,569.0,"A writer encounters the owner of an aging high-class hotel, who tells him of his early years serving as a lobby boy in the hotel's glorious years under an exceptional concierge.",Wes Anderson,,Stefan Zweig, Wes Anderson,Ralph Fiennes, F. Murray Abraham, Mathieu Amalric
191,To Be or Not to Be,8.1,1942,https://www.imdb.com//title/tt0035446/,USA,,,,,,English, German,,,,,4578000.0,Romaine Film Corporation,,,99.0,Passed,Comedy, War,,25259.0,130.0,75.0,"During the Nazi occupation of Poland, an acting troupe becomes embroiled in a Polish soldier's efforts to track down a German spy.",Ernst Lubitsch,,Melchior Lengyel, Edwin Justus Mayer,Carole Lombard, Jack Benny, Robert Stack
192,Ford v Ferrari,8.1,2019,https://www.imdb.com//title/tt1950186/,USA, France,,,,,English, Italian, French, Japanese,,,225508210.0,Chernin Entertainment, Turnpike Films, Twentieth Century Fox,152.0,PG-13,Action, Biography, Drama,212293.0,1199.0,330.0,American car designer Carroll Shelby and driver Ken Miles battle corporate interference and the laws of physics to build a revolutionary race car for Ford in order to defeat Ferrari at the 24 Hours of Le Mans in 1966.,James Mangold,,Jez Butterworth, John-Henry Butterworth,Matt Damon, Christian Bale, Jon Bernthal
193,Persona,8.1,1966,https://www.imdb.com//title/tt0060827/,Sweden,,,,,,Swedish, English,,,,,12142.0,American International Pictures (AIP), Aurora, Svensk Filmindustri (SF),85.0,Not Rated,Drama, Thriller,,95593.0,218.0,137.0,A nurse is put in charge of a mute actress and finds that their personae are melding together.,Ingmar Bergman,,Ingmar Bergman,,Bibi Andersson, Liv Ullmann, Margaretha Krook
194,Before Sunrise,8.1,1995,https://www.imdb.com//title/tt0112471/,USA, Austria, Switzerland,,,,English, German, French,,,,5986708.0,Castle Rock Entertainment, Detour Filmproduction, Filmhaus Wien Universa Filmproduktions,101.0,R,Drama, Romance,,255765.0,472.0,153.0,"A young man and woman meet on a train in Europe, and wind up spending one evening together in Vienna. Unfortunately, both know that this will probably be their only night together.",Richard Linklater,,Richard Linklater, Kim Krizan,Ethan Hawke, Julie Delpy, Andrea Eckert
195,Catch Me If You Can,8.1,2002,https://www.imdb.com//title/tt0264464/,USA, Canada,,,,,English, French,,,,,352114312.0,DreamWorks, Kemp Company, Splendid Pictures,141.0,PG-13,Biography, Crime, Drama,781481.0,802.0,200.0,"A seasoned FBI agent pursues Frank Abagnale Jr. who, before his 19th birthday, successfully forged millions of dollars' worth of checks while posing as a Pan Am pilot, a doctor, and a legal prosecutor.",Steven Spielberg,,Jeff Nathanson, Frank Abagnale Jr.,Leonardo DiCaprio, Tom Hanks, Christopher Walken
196,The General,8.1,1926,https://www.imdb.com//title/tt0017925/,USA,,,,,,English,,,,,,750000.0,Buster Keaton Productions, Joseph M. Schenck Productions,,67.0,Passed,Action, Adventure, Comedy,76866.0,276.0,113.0,"When Union spies steal an engineer's beloved locomotive, he pursues it single-handedly and straight through enemy lines.",Clyde Bruckman, Buster Keaton,Buster Keaton, Clyde Bruckman,Buster Keaton, Marion Mack, Glen Cavender
197,How to Train Your Dragon,8.1,2010,https://www.imdb.com//title/tt0892769/,USA,,,,,,English,,,,,,494878759.0,DreamWorks Animation, Mad Hatter Entertainment, Vertigo Entertainment,98.0,PG,Animation, Action, Adventure,642569.0,614.0,310.0,"A hapless young Viking who aspires to hunt dragons becomes the unlikely friend of a young dragon himself, and learns there may be more to the creatures than he assumed.",Dean DeBlois, Chris Sanders,William Davies, Dean DeBlois,Jay Baruchel, Gerard Butler, Christopher Mintz-Plasse
198,Mr. Smith Goes to Washington,8.1,1939,https://www.imdb.com//title/tt0031679/,USA,,,,,,English,,,,,,144738.0,Columbia Pictures,,,129.0,Not Rated,Comedy, Drama,,102810.0,282.0,84.0,"A naive man is appointed to fill a vacancy in the United States Senate. His plans promptly collide with political corruption, but he doesn't back down.",Frank Capra,,Sidney Buchman, Lewis R. Foster,James Stewart, Jean Arthur, Claude Rains
199,Sherlock Jr.,8.1,1924,https://www.imdb.com//title/tt0015324/,USA,,,,,,English,,,,,,977375.0,Buster Keaton Productions,,,45.0,Not Rated,Action, Comedy, Romance,37956.0,311.0,66.0,"A film projectionist longs to be a detective, and puts his meagre skills to work when he is framed by a rival for stealing his girlfriend's father's pocketwatch.",Buster Keaton,,Jean C. Havez, Joseph A. Mitchell,Buster Keaton, Kathryn McGuire, Joe Keaton
200,Prisoners,8.1,2013,https://www.imdb.com//title/tt1392214/,USA,,,,,,English,,,,,,122126687.0,Alcon Entertainment, 8:38 Productions, Madhouse Entertainment,153.0,R,Crime, Drama, Mystery,568105.0,878.0,491.0,"When Keller Dover's daughter and her friend go missing, he takes matters into his own hands as the police pursue multiple leads and the pressure mounts.",Denis Villeneuve,,Aaron Guzikowski,,Hugh Jackman, Jake Gyllenhaal, Viola Davis
201,12 Years a Slave,8.1,2013,https://www.imdb.com//title/tt2024544/,UK, USA,,,,,English,,,,,,187733202.0,Regency Enterprises, River Road Entertainment, Plan B Entertainment,134.0,R,Biography, Drama, History,613655.0,849.0,613.0,"In the antebellum United States, Solomon Northup, a free black man from upstate New York, is abducted and sold into slavery.",Steve McQueen,,John Ridley, Solomon Northup,Chiwetel Ejiofor, Michael Kenneth Williams, Michael Fassbender
202,Cool Hand Luke,8.1,1967,https://www.imdb.com//title/tt0061512/,USA,,,,,,English,,,,,,0.0,Jalem Productions,,,127.0,GP,Crime, Drama,,155929.0,323.0,126.0,"A laid back Southern man is sentenced to two years in a rural prison, but refuses to conform.",Stuart Rosenberg,,Donn Pearce, Frank Pierson,Paul Newman, George Kennedy, Strother Martin
203,Mad Max: Fury Road,8.1,2015,https://www.imdb.com//title/tt1392190/,Australia, USA, South Africa,,,,English, Russian,,,,,375209362.0,Warner Bros., Village Roadshow Pictures, Kennedy Miller Productions,120.0,R,Action, Adventure, Sci-Fi,837603.0,1959.0,822.0,"In a post-apocalyptic wasteland, a woman rebels against a tyrannical ruler in search for her homeland with the aid of a group of female prisoners, a psychotic worshiper, and a drifter named Max.",George Miller,,George Miller, Brendan McCarthy,Tom Hardy, Charlize Theron, Nicholas Hoult
204,Barry Lyndon,8.1,1975,https://www.imdb.com//title/tt0072684/,UK, USA,,,,,English, German, French,,,,198992.0,Peregrine, Hawk Films, Warner Bros.,185.0,PG,Adventure, Drama, History,141959.0,446.0,106.0,An Irish rogue wins the heart of a rich widow and assumes her dead husband's aristocratic position in 18th-century England.,Stanley Kubrick,,Stanley Kubrick, William Makepeace Thackeray,Ryan O'Neal, Marisa Berenson, Patrick Magee
205,Network,8.1,1976,https://www.imdb.com//title/tt0074958/,USA,,,,,,English,,,,,,23690757.0,Metro-Goldwyn-Mayer (MGM),,,121.0,R,Drama,,,139230.0,387.0,172.0,A television network cynically exploits a deranged former anchor's ravings and revelations about the news media for its own profit.,Sidney Lumet,,Paddy Chayefsky,,Faye Dunaway, William Holden, Peter Finch
206,The Wages of Fear,8.1,1953,https://www.imdb.com//title/tt0046268/,France, Italy,,,,,French, English, Spanish, German, Italian, Russian,1098.0,Compagnie Industrielle et Commerciale Cinématographique (CICC), Filmsonor, Vera Films,131.0,Not Rated,Adventure, Drama, Thriller,51660.0,158.0,136.0,"In a decrepit South American village, four men are hired to transport an urgent nitroglycerine shipment without the equipment that would make it safe.",Henri-Georges Clouzot,,Georges Arnaud, Henri-Georges Clouzot,Yves Montand, Charles Vanel, Peter van Eyck
207,Stand by Me,8.1,1986,https://www.imdb.com//title/tt0092005/,USA,,,,,,English,,,,,,52287414.0,Columbia Pictures, Act III, Act III Communications,89.0,R,Adventure, Drama,,349764.0,680.0,130.0,"After the death of one of his friends, a writer recounts a boyhood journey with his friends to find the body of a missing boy.",Rob Reiner,,Stephen King, Raynold Gideon,Wil Wheaton, River Phoenix, Corey Feldman
208,Into the Wild,8.1,2007,https://www.imdb.com//title/tt0758758/,USA,,,,,,English, Danish,,,,,56674477.0,Paramount Vantage, Art Linson Productions, Into the Wild,148.0,R,Adventure, Biography, Drama,550677.0,924.0,241.0,"After graduating from Emory University, top student and athlete Christopher McCandless abandons his possessions, gives his entire $24,000 savings account to charity and hitchhikes to Alaska to live in the wilderness. Along the way, Christopher encounters a series of characters that shape his life.",Sean Penn,,Sean Penn, Jon Krakauer,Emile Hirsch, Vince Vaughn, Catherine Keener
209,Million Dollar Baby,8.1,2004,https://www.imdb.com//title/tt0405159/,USA,,,,,,English, Irish,,,,,216763646.0,Warner Bros., Lakeshore Entertainment, Malpaso Productions,132.0,PG-13,Drama, Sport,,614139.0,1208.0,285.0,A determined woman works with a hardened boxing trainer to become a professional.,Clint Eastwood,,Paul Haggis, F.X. Toole,Hilary Swank, Clint Eastwood, Morgan Freeman
210,Monty Python's Life of Brian,8.1,1979,https://www.imdb.com//title/tt0079470/,UK,,,,,,English, Latin,,,,,20738621.0,HandMade Films, Python (Monty) Pictures,,94.0,R,Comedy,,,353751.0,384.0,149.0,"Born on the original Christmas in the stable next door to Jesus Christ, Brian of Nazareth (Graham Chapman) spends his life being mistaken for a messiah.",Terry Jones,,Graham Chapman, John Cleese,Graham Chapman, John Cleese, Michael Palin
211,Hachi: A Dog's Tale,8.1,2009,https://www.imdb.com//title/tt1028532/,UK, USA,,,,,English, Japanese,,,,,46749646.0,Stage 6 Films, Inferno Distribution, Hachiko,93.0,G,Drama, Family,,240649.0,448.0,92.0,A college professor bonds with an abandoned dog he takes into his home.,Lasse Hallström,,Stephen P. Lindsey, Kaneto Shindô,Richard Gere, Joan Allen, Cary-Hiroyuki Tagawa
212,Ben-Hur,8.1,1959,https://www.imdb.com//title/tt0052618/,USA,,,,,,English,,,,,,74427638.0,Metro-Goldwyn-Mayer (MGM),,,212.0,G,Adventure, Drama, History,211769.0,436.0,127.0,"After a Jewish prince is betrayed and sent into slavery by a Roman friend, he regains his freedom and comes back for revenge.",William Wyler,,Lew Wallace, Karl Tunberg,Charlton Heston, Jack Hawkins, Stephen Boyd
213,Platoon,8.1,1986,https://www.imdb.com//title/tt0091763/,USA, UK,,,,,English, Vietnamese,,,,,138545632.0,Hemdale, Cinema '84, Cinema 86,120.0,R,Drama, War,,368449.0,592.0,137.0,A young soldier in Vietnam faces a moral crisis when confronted with the horrors of war and the duality of man.,Oliver Stone,,Oliver Stone,,Charlie Sheen, Tom Berenger, Willem Dafoe
214,Rush,8.1,2013,https://www.imdb.com//title/tt1979320/,UK, Germany, USA,,,,English, German, Italian, French, Spanish,,96983009.0,Exclusive Media Group, Cross Creek Pictures, Imagine Entertainment,123.0,R,Biography, Drama, Sport,415749.0,554.0,423.0,The merciless 1970s rivalry between Formula One rivals James Hunt and Niki Lauda.,Ron Howard,,Peter Morgan,,Daniel Brühl, Chris Hemsworth, Olivia Wilde
215,The Passion of Joan of Arc,8.1,1928,https://www.imdb.com//title/tt0019254/,France,,,,,,French,,,,,,21877.0,Société générale des films,,,110.0,Not Rated,Biography, Drama, History,44430.0,186.0,130.0,"In 1431, Jeanne d'Arc is placed on trial on charges of heresy. The ecclesiastical jurists attempt to force Jeanne to recant her claims of holy visions.",Carl Theodor Dreyer,,Joseph Delteil, Carl Theodor Dreyer,Maria Falconetti, Eugene Silvain, André Berley
216,Logan,8.0,2017,https://www.imdb.com//title/tt3315342/,USA,,,,,,English, Spanish,,,,,619021436.0,Twentieth Century Fox, Marvel Entertainment, TSG Entertainment,137.0,R,Action, Drama, Sci-Fi,614106.0,1533.0,634.0,"In a future where mutants are nearly extinct, an elderly and weary Logan leads a quiet life. But when Laura, a mutant child pursued by scientists, comes to him for help, he must get her to safety.",James Mangold,,James Mangold, Scott Frank,Hugh Jackman, Patrick Stewart, Dafne Keen
217,Dead Poets Society,8.0,1989,https://www.imdb.com//title/tt0097165/,USA,,,,,,English, Latin,,,,,235860116.0,Touchstone Pictures, Silver Screen Partners IV, A Steven Haft Production,128.0,PG,Comedy, Drama,,401857.0,610.0,105.0,English teacher John Keating inspires his students to look at poetry with a different perspective of authentic knowledge and feelings. -Camilo Alarcón,Peter Weir,,Tom Schulman,,Robin Williams, Robert Sean Leonard, Ethan Hawke
218,Harry Potter and the Deathly Hallows: Part 2,8.0,2011,https://www.imdb.com//title/tt1201607/,UK, USA,,,,,English,,,,,,1341932398.0,Warner Bros., Heyday Films, Moving Picture Company (MPC),130.0,PG-13,Adventure, Drama, Fantasy,731126.0,936.0,482.0,"Harry, Ron, and Hermione search for Voldemort's remaining Horcruxes in their effort to destroy the Dark Lord as the final battle rages on at Hogwarts.",David Yates,,Steve Kloves, J.K. Rowling,Daniel Radcliffe, Emma Watson, Rupert Grint
219,Andrei Rublev,8.0,1966,https://www.imdb.com//title/tt0060107/,Soviet Union,,,,,,Russian, Italian, Tatar,,,,145491.0,Mosfilm, Tvorcheskoe Obedinienie Pisateley i Kinorabotnikov,,165.0,R,Biography, Drama, History,43307.0,151.0,109.0,"The life, times and afflictions of the fifteenth-century Russian iconographer St. Andrei Rublev.",Andrei Tarkovsky,,Andrey Konchalovskiy, Andrei Tarkovsky,Anatoliy Solonitsyn, Ivan Lapikov, Nikolay Grinko
220,The 400 Blows,8.0,1959,https://www.imdb.com//title/tt0053198/,France,,,,,,French, English,,,,,127244.0,Les Films du Carrosse, Sédif Productions,,99.0,Not Rated,Crime, Drama,,99358.0,208.0,164.0,"A young boy, left without attention, delves into a life of petty crime.",François Truffaut,,François Truffaut, Marcel Moussy,Jean-Pierre Léaud, Albert Rémy, Claire Maurier
221,Hotel Rwanda,8.0,2004,https://www.imdb.com//title/tt0395169/,UK, South Africa, Italy,,,,English, French, Kinyarwanda,,,,33882243.0,United Artists, Lions Gate Films, Industrial Development Corporation of South Africa,121.0,PG-13,Biography, Drama, History,325511.0,663.0,153.0,Paul Rusesabagina was a hotel manager who housed over a thousand Tutsi refugees during their struggle against the Hutu militia in Rwanda.,Terry George,,Keir Pearson, Terry George,Don Cheadle, Sophie Okonedo, Joaquin Phoenix
222,Amores Perros,8.0,2000,https://www.imdb.com//title/tt0245712/,Mexico,,,,,,Spanish,,,,,,20908467.0,Altavista Films, Zeta Film,,154.0,R,Drama, Thriller,,216112.0,394.0,158.0,"A horrific car accident connects three stories, each involving characters dealing with loss, regret, and life's harsh realities, all in the name of love.",Alejandro G. Iñárritu,,Guillermo Arriaga,,Emilio Echevarría, Gael García Bernal, Goya Toledo
223,Rang De Basanti,8.0,2006,https://www.imdb.com//title/tt0405508/,India,,,,,,Hindi,,,,,,8846694.0,ROMP, UTV Motion Pictures,,167.0,Not Rated,Comedy, Drama,,106500.0,358.0,39.0,"The story of six young Indians who assist an English woman to film a documentary on the freedom fighters from their past, and the events that lead them to relive the long-forgotten saga of freedom.",Rakeysh Omprakash Mehra,,Renzil D'Silva, Prasoon Joshi,Aamir Khan, Soha Ali Khan, Siddharth
224,The Handmaiden,8.0,2016,https://www.imdb.com//title/tt4016934/,South Korea,,,,,,Korean, Japanese,,,,,37767206.0,Moho Film, Yong Film,,145.0,Not Rated,Drama, Romance, Thriller,98473.0,197.0,333.0,"A woman is hired as a handmaiden to a Japanese heiress, but secretly she is involved in a plot to defraud her.",Chan-wook Park,,Sarah Waters, Seo-kyeong Jeong,Min-hee Kim, Jung-woo Ha, Jin-woong Cho
